Date,Website,Title,Summary
"Tue, 17 Mar 2020 06:15:02 GMT",https://www.theguardian.com/world/video/2020/mar/17/flipping-brilliant-penguins-tour-chicago-aquarium-closed-due-to-covid-19-video,Penguins openly explore Chicago aquarium closed due to Covid-19 – video,"<p>An aquarium in Chicago has let its penguins wander around freely after closing to visitors indefinitely due to the coronavirus outbreak. The Shedd Aquarium said on social media: 'While this may be a strange time for us, these days feel normal for animals at Shedd'</p><ul><li><a href=""https://www.theguardian.com/world/video/2020/feb/14/catman-of-wuhan-the-man-rescuing-pets-abandoned-amid-coronavirus-outbreak-video"">Wuhan's cat rescuer: the man saving pets abandoned by Covid-19 – video<br></a></li><li><a href=""https://www.theguardian.com/world/live/2020/mar/05/coronavirus-live-updates-italy-germany-pandemic-europe-uk-us-australia-india-update-latest-news"">Coronavirus: latest developments</a></li></ul> <a href=""https://www.theguardian.com/world/video/2020/mar/17/flipping-brilliant-penguins-tour-chicago-aquarium-closed-due-to-covid-19-video"">Continue reading...</a>"
"Mon, 16 Mar 2020 18:29:23 GMT",https://www.theguardian.com/world/video/2020/mar/16/drone-footage-shows-empty-roads-in-italy-amid-coronavirus-lockdown-video,Drone footage shows empty roads in Italy amid coronavirus lockdown  – video,"<p>Drone footage shows a motorway in Baranzate, near Milan, almost completely empty amid a nationwide lockdown imposed by the Italian government. The European Union on Monday&nbsp; proposed suspending all non-essential inbound travel for 30 days</p><ul><li><a href=""https://www.theguardian.com/world/live/2020/mar/16/coronavirus-live-updates-us-cdc-events-europe-lockdown-uk-deaths-australia-france-italy-spain-update-latest-news"">Coronavirus updates: WHO tells governments to 'test, test, test', as EU proposes 30-day travel ban – live news</a></li><li><a href=""https://www.theguardian.com/world/2020/mar/15/life-lockdown-parma-italy-coronavirus"">Orderly, dour, cowed: how my beloved Italy is changed by coronavirus</a></li></ul> <a href=""https://www.theguardian.com/world/video/2020/mar/16/drone-footage-shows-empty-roads-in-italy-amid-coronavirus-lockdown-video"">Continue reading...</a>"
"Mon, 16 Mar 2020 17:47:30 GMT",https://www.theguardian.com/world/video/2020/mar/16/coronavirus-johnson-asks-britons-to-stop-non-essential-contact-video,Coronavirus: Johnson asks Britons to stop 'non-essential contact' – video,"<p>Boris Johnson has announced new measures to slow the spread of the coronavirus outbreak in Britain. The measures include whole household isolation and avoiding mass gatherings&nbsp;</p><ul><li><a href=""https://www.theguardian.com/politics/live/2020/mar/16/boris-johnson-press-conference-coronavirus-live-firms-could-soon-be-allowed-to-run-reduced-services-because-of-coronavirus-shapps-suggests-politics-live"">Boris Johnson warns UK population to avoid non-essential contact with others as coronavirus cases rise – politics live</a></li><li><a href=""https://www.theguardian.com/world/2020/mar/16/coronavirus-symptoms-should-i-see-doctor-cough-covid-19"">Coronavirus: education officials to discuss possible school closures in England</a></li><li><a href=""https://www.theguardian.com/world/2020/mar/16/coronavirus-symptoms-should-i-see-doctor-cough-covid-19"">Coronavirus symptoms: what are they and should I see a doctor?</a></li></ul><p><br></p> <a href=""https://www.theguardian.com/world/video/2020/mar/16/coronavirus-johnson-asks-britons-to-stop-non-essential-contact-video"">Continue reading...</a>"
"Mon, 16 Mar 2020 17:36:24 GMT",https://www.theguardian.com/world/video/2020/mar/16/coronavirus-racism-and-solidarity-before-and-after-italys-lockdown-video,"Coronavirus, racism and solidarity, before and after Italy's lockdown – video","<p>Meet Sonia Zhou who runs a popular Chinese restaurant in Rome's Chinatown. She has been forced to shut up shop, in part, due to people avoiding the area after the coronavirus outbreak. Italy has seen increased incidences of anti-Chinese racism but also much-needed acts of solidarity as it goes into national lockdown.</p><ul><li><a href=""https://viewer.gutools.co.uk/world/live/2020/mar/15/coronavirus-latest-updates-trump-tests-negative-as-spain-orders-nationwide-lockdown-uk-us-australia-italy-europe-global-economy"">Coronavirus – latest updates</a></li><li><a href=""https://viewer.gutools.co.uk/world/2020/mar/15/100m-europeans-on-lockdown-as-countries-battle-coronavirus"">Germany seals its borders as 100m Europeans on lockdown</a><br></li><li><a href=""https://viewer.gutools.co.uk/world/2020/mar/14/coronavirus-uk-supermarkets-panic-buying"">UK supermarkets appeal for calm as shelves empty</a><br></li><li><a href=""https://viewer.gutools.co.uk/world/2020/mar/15/spain-city-streets-turn-quiet-coronavirus-lockdown-madrid-barcelona"">Spain's streets turn eerily quiet following coronavirus lockdown</a></li></ul> <a href=""https://www.theguardian.com/world/video/2020/mar/16/coronavirus-racism-and-solidarity-before-and-after-italys-lockdown-video"">Continue reading...</a>"
"Mon, 16 Mar 2020 17:05:00 GMT",https://www.theguardian.com/world/video/2020/mar/16/test-test-test-who-calls-for-more-coronavirus-testing-video,"'Test, test, test': WHO calls for more coronavirus testing – video","<p>The World Health Organization director general, Tedros Adhanom Ghebreyesus, says he has a simple message to countries on how to deal with the coronavirus outbreak sweeping the globe: 'Test, test, test.' Speaking during a news conference on Monday he urged countries to test more suspected cases, warning that they 'cannot fight a fire blindfolded'&nbsp;</p><ul><li><a href=""https://www.theguardian.com/world/live/2020/mar/16/coronavirus-live-updates-us-cdc-events-europe-lockdown-uk-deaths-australia-france-italy-spain-update-latest-news"">Coronavirus updates: WHO tells countries to 'test, test, test', as EU proposes 30-day travel ban – live news</a></li></ul> <a href=""https://www.theguardian.com/world/video/2020/mar/16/test-test-test-who-calls-for-more-coronavirus-testing-video"">Continue reading...</a>"
"Mon, 16 Mar 2020 15:42:55 GMT",https://www.theguardian.com/world/gallery/2020/mar/16/coronavirus-photos-us-new-york-seattle-washington,The week that Covid-19 shut the US down – in pictures,"<p>Cities and states across the US, from New York to Washington state, saw empty streets, sporting games cancelled and Disneyland shuttered over the coronavirus pandemic</p><ul><li><a href=""https://www.theguardian.com/us-news/live/2020/mar/16/donald-trump-joe-biden-bernie-sanders-coronavirus-live-news-updates"">Coronavirus – latest updates</a></li><li><a href=""https://www.theguardian.com/world/coronavirus-outbreak"">See all our coronavirus coverage</a></li></ul> <a href=""https://www.theguardian.com/world/gallery/2020/mar/16/coronavirus-photos-us-new-york-seattle-washington"">Continue reading...</a>"
"Mon, 16 Mar 2020 12:43:49 GMT",https://www.theguardian.com/world/video/2020/mar/16/coronavirus-celebrities-actors-singers-footballers-advice-staying-safe-video,"Coronavirus: actors, singers and footballers share advice on staying safe – video","<p>Celebrities have been advising people about what to do to minimise the risk of contracting coronavirus. Arnold Schwarzenegger, accompanied by his miniature horse and pet donkey, suggested people should not leave their homes, while others focused on demonstrating different activities that people can do to make sure they are washing their hands for long enough – from reciting poems to kicking a football around</p><ul><li><a href=""https://www.theguardian.com/world/live/2020/mar/16/coronavirus-live-updates-us-cdc-events-europe-lockdown-uk-deaths-australia-france-italy-spain-update-latest-news"">Coronavirus updates - live</a></li><li><a href=""https://www.theguardian.com/world/2020/mar/16/coronavirus-uk-cases-how-many-are-in-your-area-covid-19"">Coronavirus UK cases: find out how many are in your area</a><br></li><li><a href=""https://www.theguardian.com/society/2020/mar/16/coronavirus-health-anxiety"">If coronavirus scares you, read this to take control over your health anxiety | Rhiannon Lucy Cosslett</a><br></li></ul> <a href=""https://www.theguardian.com/world/video/2020/mar/16/coronavirus-celebrities-actors-singers-footballers-advice-staying-safe-video"">Continue reading...</a>"
